{
    "$schema": "https://raw.githubusercontent.com/foreverealize/zyp-anime-db/main/schemas/season.schema.json",
    "id": "haikyuu-2",
    "number": 2,
    "name": "Haikyuu!!: Season 2",
    "releaseStart": "2015-10-04",
    "releaseEnd": "2016-03-27",
    "episodes": [
        "haikyuu-2-1",
        "haikyuu-2-2",
        "haikyuu-2-3",
        "haikyuu-2-4",
        "haikyuu-2-5",
        "haikyuu-2-6",
        "haikyuu-2-7",
        "haikyuu-2-8",
        "haikyuu-2-9",
        "haikyuu-2-10",
        "haikyuu-2-11",
        "haikyuu-2-12",
        "haikyuu-2-13",
        "haikyuu-2-14",
        "haikyuu-2-15",
        "haikyuu-2-16",
        "haikyuu-2-17",
        "haikyuu-2-18",
        "haikyuu-2-19",
        "haikyuu-2-20",
        "haikyuu-2-21",
        "haikyuu-2-22",
        "haikyuu-2-23",
        "haikyuu-2-24",
        "haikyuu-2-25"
    ]
}