{
    "$schema": "https://raw.githubusercontent.com/foreverealize/zyp-anime-db/main/schemas/season.schema.json",
    "id": "horimiya-1",
    "number": 1,
    "name": "Horimiya: Season 1",
    "releaseStart": "2021-01-10",
    "releaseEnd": "2021-04-04",
    "episodes": [
        "horimiya-1-1",
        "horimiya-1-2",
        "horimiya-1-3",
        "horimiya-1-4",
        "horimiya-1-5",
        "horimiya-1-6",
        "horimiya-1-7",
        "horimiya-1-8",
        "horimiya-1-9",
        "horimiya-1-10",
        "horimiya-1-11",
        "horimiya-1-12",
        "horimiya-1-13"
    ]
}