{
    "$schema": "https://raw.githubusercontent.com/foreverealize/zyp-anime-db/main/schemas/season.schema.json",
    "id": "given-1",
    "number": 1,
    "name": "Given: Season 1",
    "releaseStart": "2019-07-12",
    "releaseEnd": "2019-09-20",
    "episodes": [
        "given-1-1",
        "given-1-2",
        "given-1-3",
        "given-1-4",
        "given-1-5",
        "given-1-6",
        "given-1-7",
        "given-1-8",
        "given-1-9",
        "given-1-10",
        "given-1-11"
    ]
}