{
    "$schema": "https://raw.githubusercontent.com/foreverealize/zyp-anime-db/main/schemas/season.schema.json",
    "id": "school-babysitters-1",
    "number": 1,
    "name": "School Babysitters: Season 1",
    "releaseStart": "2018-01-07",
    "releaseEnd": "2018-03-25",
    "episodes": [
        "school-babysitters-1-1",
        "school-babysitters-1-2",
        "school-babysitters-1-3",
        "school-babysitters-1-4",
        "school-babysitters-1-5",
        "school-babysitters-1-6",
        "school-babysitters-1-7",
        "school-babysitters-1-8",
        "school-babysitters-1-9",
        "school-babysitters-1-10",
        "school-babysitters-1-11",
        "school-babysitters-1-12"
    ]
}