{
    "$schema": "https://raw.githubusercontent.com/foreverealize/zyp-anime-db/main/schemas/season.schema.json",
    "id": "noragami-1",
    "number": 1,
    "name": "Noragami: Season 1",
    "releaseStart": "2014-01-05",
    "releaseEnd": "2014-03-23",
    "episodes": [
        "noragami-1-1",
        "noragami-1-2",
        "noragami-1-3",
        "noragami-1-4",
        "noragami-1-5",
        "noragami-1-6",
        "noragami-1-7",
        "noragami-1-8",
        "noragami-1-9",
        "noragami-1-10",
        "noragami-1-11",
        "noragami-1-12"
    ]
}