{
    "$schema": "https://raw.githubusercontent.com/foreverealize/zyp-anime-db/main/schemas/season.schema.json",
    "id": "neon-genesis-evangelion-1",
    "number": 1,
    "name": "Neon Genesis Evangelion: Season 1",
    "releaseStart": "1995-10-04",
    "releaseEnd": "1996-03-27",
    "episodes": [
        "neon-genesis-evangelion-1-1",
        "neon-genesis-evangelion-1-2",
        "neon-genesis-evangelion-1-3",
        "neon-genesis-evangelion-1-4",
        "neon-genesis-evangelion-1-5",
        "neon-genesis-evangelion-1-6",
        "neon-genesis-evangelion-1-7",
        "neon-genesis-evangelion-1-8",
        "neon-genesis-evangelion-1-9",
        "neon-genesis-evangelion-1-10",
        "neon-genesis-evangelion-1-11",
        "neon-genesis-evangelion-1-12",
        "neon-genesis-evangelion-1-13",
        "neon-genesis-evangelion-1-14",
        "neon-genesis-evangelion-1-15",
        "neon-genesis-evangelion-1-16",
        "neon-genesis-evangelion-1-17",
        "neon-genesis-evangelion-1-18",
        "neon-genesis-evangelion-1-19",
        "neon-genesis-evangelion-1-20",
        "neon-genesis-evangelion-1-21",
        "neon-genesis-evangelion-1-22",
        "neon-genesis-evangelion-1-23",
        "neon-genesis-evangelion-1-24",
        "neon-genesis-evangelion-1-25",
        "neon-genesis-evangelion-1-26"
    ]
}